mined_at,tweet_id,tweet_id_str,in_reply_to_screen_name,in_reply_to_status_id,in_reply_to_user_id,hashtags,source,language,created_at,year,month,day,day_of_week,hour,minute,screen_name,user_tweet_id,user_tweet_id_str,user_favourites_count,followers_count,friends_count,text,user_screen_name,user_id,user_location
2020-06-21 12:17:07.655257,1273583869753724930,1273583869753724930,jelleprins,1.273583081321042e+18,16546619.0,[],"<a href=""https://mobile.twitter.com"" rel=""nofollow"">Twitter Web App</a>",nl,2020-06-18 11:50:31+00:00,2020,6,18,3,11,50,GHengeveld,20709019.0,20709019.0,889.0,1484,1750,"@jelleprins @picnic @JumboSupermarkt @albertheijn Geen ervaring met die van Jumbo of AH, maar die van Picnic is so gebruiksvriendelijk dat mijn zoontje van 3 de boodschappen doet.",,,
2020-06-21 12:17:09.519252,1273585426268409859,1273585426268409859,Oli4K,1.2735842313362885e+18,6091182.0,[],"<a href=""http://twitter.com/download/iphone"" rel=""nofollow"">Twitter for iPhone</a>",nl,2020-06-18 11:56:42+00:00,2020,6,18,3,11,56,jelleprins,16546619.0,16546619.0,4416.0,10513,1063,"@Oli4K @picnic @JumboSupermarkt @albertheijn Lijkt er op dat Jumbo &amp; AH erg naar website &amp; elkaar hebben gekeken, terwijl Picnic echt mobile first &amp; vanuit niks is gestart.",,,
2020-06-21 12:17:08.403804,1273616458459705347,1273616458459705347,,,,[],"<a href=""https://about.twitter.com/products/tweetdeck"" rel=""nofollow"">TweetDeck</a>",nl,2020-06-18 14:00:01+00:00,2020,6,18,3,14,0,agfnl,164631799.0,164631799.0,84.0,8530,2128,"""Trendbreuk: Jumbo al 3 weken duurder in AGF dan AH, Picnic volgt""
https://t.co/mVfpqWNoT7 https://t.co/vPVSFN5S49",,,
2020-06-21 12:17:09.120192,1273632376950849537,1273632376950849537,,,,[],"<a href=""http://twitter.com/download/android"" rel=""nofollow"">Twitter for Android</a>",nl,2020-06-18 15:03:16+00:00,2020,6,18,3,15,3,martiendas,111582731.0,111582731.0,10982.0,4649,5115,"Half juni en nog steeds worden boodschappen bezorgd bij meerdere huizen in de straat door AH, Jumbo, Picnic. Benieuwd: is dat blijvend of gaan mensen toch weer zelf naar de winkel over een tijdje? Onze boodschappen werden al langer bezorgd, wegens geen biowinkel hier @Korenmaat",,,
